project_id,workspace_id,project_name,project_type,description,owner_user_id,technology_stack,status,budget_usd,start_date,end_date
PROJ000001,WS0018,Project-1,AI Product,Eye ago total itself watch. Know fact mission car art blue voice entire.,USR000547,Java Spring,On Hold,308576,2024-10-28,2025-03-18
PROJ000002,WS0017,Project-2,CRM System,Order consider number four body. Between much ahead choose single difficult study.,USR000769,Vue,On Hold,329461,2025-12-15,2026-01-31
PROJ000003,WS0003,Project-3,CRM System,Shake listen worry east director economy candidate outside. Possible glass be. Team movie purpose interview from.,USR000010,React,Active,127998,2024-04-26,2025-03-18
PROJ000004,WS0019,Project-4,Web Application,Miss lay area charge mean. Development performance difficult your top according future.,USR000242,Django,Completed,383949,2026-03-04,2026-04-03
PROJ000005,WS0005,Project-5,Cloud Platform,Age rate week hit see peace. Training involve form future law discussion. Green story accept.,USR000371,Angular,Planning,75611,2024-07-02,2027-06-07
PROJ000006,WS0022,Project-6,AI Product,Officer either nothing too letter resource answer.,USR000021,Node.js,On Hold,302841,2025-05-19,2025-11-06
PROJ000007,WS0013,Project-7,AI Product,Ground official color college.,USR000473,React,Planning,469362,2023-10-15,2026-05-31
PROJ000008,WS0009,Project-8,Web Application,Home toward national possible artist. Want good serve local family.,USR000640,React,Planning,149501,2026-04-21,2027-06-02
PROJ000009,WS0028,Project-9,Web Application,Shake enough leg likely leave. Southern product development officer right weight.,USR000579,Vue,Completed,271388,2024-11-29,2027-06-06
PROJ000010,WS0030,Project-10,AI Product,Beyond wife billion exactly family. Entire group election civil much allow interesting this. Despite sometimes defense wind wide.,USR000437,Django,Active,444983,2023-10-23,2025-03-25
PROJ000011,WS0020,Project-11,Web Application,Million law Congress dream the whole. Can care together many play money respond. Character let hold morning.,USR000514,React,Planning,492263,2025-12-18,2027-01-12
PROJ000012,WS0004,Project-12,Analytics Dashboard,Attorney listen see pick respond difference.,USR000179,Node.js,Active,275273,2023-11-24,2026-09-29
PROJ000013,WS0022,Project-13,AI Product,Kid sport message long able owner. Suggest school nation expert media. Would organization pick rise difference.,USR000647,Python/FastAPI,Planning,413311,2023-09-30,2026-09-02
PROJ000014,WS0006,Project-14,AI Product,Claim debate quality middle success. Population point know business early above. Financial friend across none that heavy condition past.,USR000350,Node.js,Active,334210,2025-01-21,2025-04-04
PROJ000015,WS0019,Project-15,Web Application,Care reflect might pick far. Scientist wrong trip expert staff miss speech. By choose guy get raise point once.,USR000534,Angular,Active,259958,2025-03-06,2025-06-23
PROJ000016,WS0001,Project-16,Cloud Platform,Stock hot others organization evening success task. Network safe even series wrong. Tv charge probably develop time day.,USR000172,Node.js,On Hold,286404,2025-03-23,2026-02-27
PROJ000017,WS0025,Project-17,ERP System,Defense game by whole between chair. Green door agent both for far.,USR000288,Angular,Planning,393304,2025-02-03,2025-06-06
PROJ000018,WS0023,Project-18,Internal Tool,Product bit analysis. Firm minute sometimes. Indeed check impact thus once present.,USR000230,Python/FastAPI,Active,249314,2024-06-01,2024-06-06
PROJ000019,WS0015,Project-19,Mobile Application,Bank buy by cultural. Store staff check enter as herself social.,USR000771,Java Spring,Planning,407665,2023-12-10,2025-01-24
PROJ000020,WS0016,Project-20,Cloud Platform,Color phone popular want nothing future.,USR000165,Flutter,Planning,499877,2025-06-27,2026-03-03
PROJ000021,WS0008,Project-21,CRM System,Little situation but whatever continue country.,USR000217,Angular,Completed,267281,2026-06-03,2027-03-06
PROJ000022,WS0003,Project-22,Analytics Dashboard,Name street tend opportunity. Report discussion central require mean. Yard war evening system.,USR000646,Angular,On Hold,232465,2025-11-20,2026-06-05
PROJ000023,WS0025,Project-23,Analytics Dashboard,Tend economic among simply leave life right. Little responsibility indicate special. Serve hair manager find some wish.,USR000442,Python/FastAPI,On Hold,167026,2026-02-20,2026-07-12
PROJ000024,WS0019,Project-24,Mobile Application,Skill ahead rule debate individual whom open two. Leave idea coach. Theory less to nearly ground next where know.,USR000110,Vue,Completed,109365,2026-03-01,2027-03-21
PROJ000025,WS0018,Project-25,Analytics Dashboard,Clearly teacher within case front child.,USR000526,React,Planning,275929,2024-01-07,2024-04-19
PROJ000026,WS0021,Project-26,Cloud Platform,Conference performance event realize either first beat. During us democratic wrong along large pressure. Nothing because short two work before. Ten wonder clearly involve until weight figure.,USR000253,Flutter,Active,437344,2025-09-06,2026-03-13
PROJ000027,WS0025,Project-27,Mobile Application,Market protect stand increase drop which. Determine would technology once. Fear company staff.,USR000280,Vue,Active,317017,2023-09-11,2025-03-24
PROJ000028,WS0007,Project-28,ERP System,Home city college people event change under town. Fast population him indeed information. Determine food science teach.,USR000603,Angular,Planning,254432,2026-01-25,2026-02-11
PROJ000029,WS0011,Project-29,Analytics Dashboard,Last talk model step. Cell knowledge team. Meeting foot end.,USR000462,React,On Hold,383721,2023-10-27,2026-05-27
PROJ000030,WS0010,Project-30,Web Application,Onto consumer factor former. Home north manager fear sign unit.,USR000001,Angular,On Hold,175799,2026-05-02,2026-10-18
PROJ000031,WS0028,Project-31,Analytics Dashboard,Audience military blue receive. Forward seat along red rather team. Material owner war season place. Strategy popular suggest sing for example.,USR000738,Django,Planning,18959,2025-08-16,2026-03-18
PROJ000032,WS0030,Project-32,Cloud Platform,Thing standard situation no. Whole year Republican go far instead major. Position let coach law real year. Try fine eye change experience day way.,USR000232,React,Completed,413014,2023-11-24,2024-05-19
PROJ000033,WS0002,Project-33,Internal Tool,Close Democrat line consider. Prepare pay from treatment forward so yet. Firm kid training administration experience candidate. Continue range science since development this southern.,USR000612,React,Planning,183593,2024-08-17,2027-03-16
PROJ000034,WS0004,Project-34,Internal Tool,State wonder seat throw. Call sure medical kind hot maybe. Small then should onto still share perhaps oil. Heavy wait purpose reality stage plan.,USR000181,Python/FastAPI,On Hold,397417,2024-11-29,2026-01-04
PROJ000035,WS0018,Project-35,Mobile Application,Paper type game year. Way hospital commercial situation country than. Practice music mind prepare voice.,USR000375,Flutter,On Hold,110842,2023-09-21,2024-04-07
PROJ000036,WS0011,Project-36,Web Application,There everything their rather. Low official thought military require usually consider. Apply rate more decision.,USR000333,Django,Completed,64239,2024-07-14,2025-01-26
PROJ000037,WS0012,Project-37,Mobile Application,Suggest fire establish executive. Apply reveal also bed much window ground.,USR000126,Flutter,Completed,122402,2024-12-15,2027-03-16
PROJ000038,WS0010,Project-38,Web Application,Require factor same coach together. Foot too such plant born.,USR000272,Node.js,On Hold,395464,2024-02-29,2025-08-15
PROJ000039,WS0018,Project-39,Analytics Dashboard,Wonder fly realize lawyer collection something get. Early strategy pretty four everyone property.,USR000455,Django,On Hold,242107,2026-03-20,2026-08-09
PROJ000040,WS0008,Project-40,Internal Tool,Option guy after rich school choose election nothing. Around travel nation believe success computer.,USR000472,Vue,Planning,249920,2025-07-25,2027-06-25
PROJ000041,WS0024,Project-41,Cloud Platform,Human next thus share difference issue subject. Much whole measure report night.,USR000098,Flutter,Completed,16044,2026-05-06,2026-07-31
PROJ000042,WS0023,Project-42,Web Application,Resource truth old. Relationship since resource effort. Huge policy consumer can now least.,USR000799,React,On Hold,458468,2024-10-18,2025-11-26
PROJ000043,WS0029,Project-43,Internal Tool,May few machine reduce hold. Site color whole what full. Shoulder color indicate wall large.,USR000058,Django,Planning,497776,2026-03-26,2026-06-26
PROJ000044,WS0016,Project-44,ERP System,Bank hear large amount discuss head adult choose. Eat everything garden do. Fact would nature tonight direction family where. Job government decision sea.,USR000487,Node.js,Active,406273,2025-08-14,2026-11-22
PROJ000045,WS0013,Project-45,Web Application,Inside low fly value baby.,USR000364,Angular,On Hold,365908,2024-07-17,2026-12-29
PROJ000046,WS0018,Project-46,CRM System,Back forward front science a old.,USR000270,React,On Hold,147703,2024-01-24,2025-04-14
PROJ000047,WS0029,Project-47,AI Product,Indeed responsibility war message week.,USR000545,Flutter,Completed,396903,2025-11-23,2027-06-24
PROJ000048,WS0024,Project-48,Web Application,Shoulder couple seek rather. Few while whom consumer somebody water. Note red true establish hear.,USR000042,Java Spring,On Hold,80829,2025-10-31,2026-10-05
PROJ000049,WS0030,Project-49,Mobile Application,Action see nothing education happen color music. Wide he big range dark nothing. Story design return produce voice read.,USR000532,Angular,Active,378463,2025-05-05,2025-09-08
PROJ000050,WS0017,Project-50,ERP System,Add power official those. Buy red TV few media television mouth. Leader almost computer miss.,USR000706,React,Planning,154867,2025-08-05,2026-04-19
PROJ000051,WS0012,Project-51,Mobile Application,Dinner seven step no ground guess. Physical apply according color dinner cell.,USR000502,Vue,Completed,361410,2023-10-01,2024-06-19
PROJ000052,WS0020,Project-52,Analytics Dashboard,Across either nation. Type physical spend his.,USR000431,Flutter,Completed,191238,2025-04-25,2026-02-27
PROJ000053,WS0021,Project-53,CRM System,Back without blue hand relate animal bank player. Focus them song throughout with. Majority close increase evening raise she you. Energy picture rise organization.,USR000410,Node.js,Planning,246824,2024-01-09,2026-06-06
PROJ000054,WS0003,Project-54,AI Product,Majority bring skin call benefit picture. Section read deal career.,USR000684,Vue,Completed,106154,2026-04-20,2027-07-01
PROJ000055,WS0001,Project-55,Cloud Platform,Describe good simple another who away. Key hope phone contain while his.,USR000570,Node.js,Planning,281949,2025-08-21,2026-12-17
PROJ000056,WS0015,Project-56,Mobile Application,Maybe far increase light animal. Loss drug voice professor finish. Along organization book main open nearly.,USR000645,React,On Hold,165056,2025-04-06,2025-08-03
PROJ000057,WS0022,Project-57,Web Application,Design those grow new occur them. Side put best Mrs western represent sometimes.,USR000756,Java Spring,Active,149493,2024-10-23,2025-07-16
PROJ000058,WS0002,Project-58,CRM System,Employee interview face. Where woman after protect this quickly almost thus. Side quality the traditional entire.,USR000730,Java Spring,Planning,298402,2024-10-08,2025-11-04
PROJ000059,WS0001,Project-59,Analytics Dashboard,Need material reveal also not. Anything try enter various truth. Among word house them difference best personal.,USR000484,React,Planning,491966,2026-05-30,2026-06-25
PROJ000060,WS0016,Project-60,ERP System,Ago thus of class affect occur news. Candidate wish at loss product career. Environmental or answer opportunity responsibility while.,USR000251,Python/FastAPI,Completed,119230,2026-05-15,2027-02-21
PROJ000061,WS0008,Project-61,AI Product,Miss serve lay education friend miss test. Yard middle produce character.,USR000279,Node.js,Completed,71001,2023-11-11,2024-05-19
PROJ000062,WS0018,Project-62,CRM System,Field these happen response participant shoulder. Something all behavior agreement few fire tell. Door agree senior policy much send herself.,USR000102,Vue,Planning,243585,2024-11-16,2026-02-19
PROJ000063,WS0028,Project-63,Web Application,Cup about star grow care leave. Future than number fine life food second.,USR000040,Vue,Planning,497412,2025-12-20,2027-04-18
PROJ000064,WS0014,Project-64,CRM System,Agency kitchen hold arm wall movie put. Stock debate want feeling. Office so maybe war trade security.,USR000658,Vue,Completed,452450,2024-08-19,2026-02-14
PROJ000065,WS0004,Project-65,Analytics Dashboard,Capital take turn. Campaign nation much.,USR000758,React,On Hold,131551,2025-03-30,2025-07-21
PROJ000066,WS0013,Project-66,ERP System,Plant thousand add effort notice. Safe community number hotel.,USR000164,Java Spring,On Hold,129982,2023-10-16,2024-07-20
PROJ000067,WS0010,Project-67,AI Product,Television science real.,USR000774,Vue,On Hold,59723,2026-01-02,2027-01-27
PROJ000068,WS0009,Project-68,Analytics Dashboard,Activity east leg lay. End once price professor water many. Center community structure part wall case. Control kid style less price world everyone.,USR000751,React,On Hold,198117,2026-04-26,2026-05-31
PROJ000069,WS0006,Project-69,Internal Tool,Describe left hot pattern. In prepare pull range. World role tough card.,USR000249,React,Completed,301054,2024-05-08,2024-10-15
PROJ000070,WS0015,Project-70,Web Application,Car all attack analysis. Song option model.,USR000376,Node.js,Planning,200459,2026-04-15,2026-12-04
PROJ000071,WS0020,Project-71,Internal Tool,South hotel budget couple. Father rest themselves southern attack performance turn.,USR000059,Vue,Planning,372738,2024-06-28,2026-05-13
PROJ000072,WS0008,Project-72,Mobile Application,Here take foreign shake system firm painting consider. Wall involve big behavior wall ago. Suffer real class. Especially cold past.,USR000100,Python/FastAPI,Active,369119,2025-08-18,2026-12-14
PROJ000073,WS0029,Project-73,CRM System,Soon let yet nearly physical message agency. While investment face.,USR000411,React,Planning,136110,2025-03-22,2025-10-20
PROJ000074,WS0024,Project-74,Web Application,Even view have collection often increase. Day as model itself industry thank. Six also much.,USR000686,Flutter,On Hold,98850,2025-05-30,2027-04-09
PROJ000075,WS0025,Project-75,Mobile Application,Eye moment number fill off level nice either. Of anything relationship that night voice.,USR000468,Angular,Completed,190985,2026-02-23,2026-12-08
PROJ000076,WS0023,Project-76,Internal Tool,Pull hair this. Another area above back rich here a. Player condition both catch talk before store.,USR000747,Java Spring,On Hold,443839,2024-11-30,2025-11-21
PROJ000077,WS0025,Project-77,Analytics Dashboard,Security yourself goal head. Suddenly focus my interview.,USR000487,Django,Completed,35555,2025-09-15,2026-10-23
PROJ000078,WS0019,Project-78,Mobile Application,Here suggest save it. Fund measure medical forward.,USR000237,Java Spring,Completed,55776,2024-06-02,2027-05-28
PROJ000079,WS0021,Project-79,CRM System,Way level cultural. Hot always red opportunity near appear. Computer class keep just interest recognize. Second sense difference land.,USR000315,Python/FastAPI,Active,359484,2023-09-17,2025-08-25
PROJ000080,WS0014,Project-80,ERP System,Field across process sound hope before. Direction daughter nor field economy trial. Thank impact discussion she light easy more cultural.,USR000149,Python/FastAPI,Completed,482970,2023-08-08,2025-09-14
PROJ000081,WS0030,Project-81,Mobile Application,Imagine Republican under cell account.,USR000050,Vue,Planning,440404,2026-06-04,2026-11-10
PROJ000082,WS0015,Project-82,Analytics Dashboard,Difference child happy suffer out. Walk once for together police.,USR000714,Django,Active,308957,2026-05-05,2026-10-29
PROJ000083,WS0024,Project-83,ERP System,List loss brother someone understand. Meet phone painting more. Beyond human night baby party eye our.,USR000549,Python/FastAPI,Completed,102463,2024-03-06,2025-12-07
PROJ000084,WS0020,Project-84,Internal Tool,Line still light morning. Power edge information possible. Certainly pick care other.,USR000062,Java Spring,Completed,256758,2024-08-21,2025-12-01
PROJ000085,WS0019,Project-85,ERP System,Each American difference feel whatever. Base campaign lead human out.,USR000025,Node.js,On Hold,37135,2023-08-03,2023-10-07
PROJ000086,WS0006,Project-86,AI Product,Skin various loss when.,USR000010,Django,Completed,279010,2025-10-01,2025-11-04
PROJ000087,WS0013,Project-87,Analytics Dashboard,Environment everything no. Though a capital grow. Into meet successful decade wife participant.,USR000276,Vue,Planning,137866,2026-06-21,2027-05-09
PROJ000088,WS0009,Project-88,CRM System,Page difference forget TV perhaps big answer. Writer avoid size represent want beautiful. House win high section gas out training.,USR000338,Java Spring,On Hold,389114,2025-01-24,2025-12-20
PROJ000089,WS0011,Project-89,Cloud Platform,Same get Democrat. Look else from question choice agree blood event. Consider night reveal nature.,USR000621,Java Spring,On Hold,266692,2025-02-05,2026-01-13
PROJ000090,WS0029,Project-90,Internal Tool,Term cut energy car. Always growth pretty direction require.,USR000650,Vue,Completed,43666,2024-01-12,2026-11-02
PROJ000091,WS0030,Project-91,Analytics Dashboard,Listen rich deep physical.,USR000214,Node.js,Planning,297568,2026-04-13,2026-08-11
PROJ000092,WS0008,Project-92,Analytics Dashboard,Glass church sense drug expert despite former. Detail relate particular.,USR000387,Node.js,On Hold,484314,2023-12-18,2026-03-31
PROJ000093,WS0003,Project-93,Mobile Application,Team catch sell statement moment herself movie. Value history factor suffer firm office like.,USR000787,Node.js,Planning,194002,2025-12-09,2027-05-15
PROJ000094,WS0028,Project-94,Web Application,Billion green begin cold century key actually.,USR000226,Flutter,On Hold,421689,2025-06-25,2027-05-14
PROJ000095,WS0008,Project-95,CRM System,Memory player end each. Board hour wrong blood traditional loss draw. Still some former six history. Blood out everyone blue worker hope.,USR000106,Django,On Hold,440350,2024-06-08,2025-09-28
PROJ000096,WS0008,Project-96,ERP System,International or officer daughter. Behavior walk heavy rest.,USR000709,Angular,Planning,110227,2025-03-12,2026-07-31
PROJ000097,WS0022,Project-97,Analytics Dashboard,Pattern arrive while score could decade administration. First feel ago her system by. Option some particularly employee agree rule join. Service nothing little group.,USR000209,Node.js,Planning,60866,2025-09-26,2026-01-11
PROJ000098,WS0016,Project-98,Mobile Application,East fine industry modern former federal also. Pattern discover anything attorney thank society red.,USR000513,Angular,Completed,149238,2025-08-22,2026-05-08
PROJ000099,WS0014,Project-99,ERP System,Agency early page step. Without nothing my police still involve response.,USR000617,Flutter,Completed,242508,2025-11-01,2026-08-31
PROJ000100,WS0023,Project-100,CRM System,Simply game behind eight age alone positive. Father both indicate relate. Someone statement authority nor operation.,USR000263,Java Spring,Completed,252987,2024-07-13,2027-05-24
PROJ000101,WS0021,Project-101,Analytics Dashboard,Push letter health market. Our toward process attorney question.,USR000406,Django,On Hold,396177,2024-07-30,2024-10-04
PROJ000102,WS0021,Project-102,Internal Tool,Situation travel focus unit. Manage TV left protect fact defense. Animal whom citizen join so leave evening a.,USR000147,Vue,Active,379189,2025-10-16,2026-08-03
PROJ000103,WS0019,Project-103,Analytics Dashboard,Idea lawyer perhaps better model would show its. Draw ability nearly treat toward loss rate mouth. Girl have soldier senior consider serve.,USR000053,Django,On Hold,344461,2024-09-21,2025-07-03
PROJ000104,WS0022,Project-104,AI Product,Idea report benefit our. Me policy cup. Require thus worry where. General crime knowledge leg dream want.,USR000191,React,Active,266848,2024-03-04,2026-11-02
PROJ000105,WS0022,Project-105,Web Application,Face piece trip play fly find almost. Teacher four local gun team explain week.,USR000625,Django,Planning,299976,2024-12-25,2026-05-09
PROJ000106,WS0019,Project-106,ERP System,Rise value young every interest lot animal house. Area offer drug head. Industry far billion discover.,USR000462,Node.js,On Hold,485444,2023-08-09,2027-07-11
PROJ000107,WS0027,Project-107,ERP System,President firm magazine region what. Try all my join.,USR000124,React,Completed,102328,2024-01-10,2027-02-13
PROJ000108,WS0029,Project-108,Web Application,Represent trip suggest peace direction better mention. Peace station traditional common report order box yard.,USR000069,Python/FastAPI,Completed,298071,2023-08-23,2027-02-16
PROJ000109,WS0018,Project-109,CRM System,Major attention southern. Them wonder much either drop character. Stock hear defense loss vote room create.,USR000397,Angular,Planning,396103,2024-12-05,2025-06-01
PROJ000110,WS0015,Project-110,ERP System,Part shoulder fly wide here professional star. Difficult car court standard political. Return may pattern protect us purpose enough relate. Prepare would drop tax entire fight actually.,USR000609,Node.js,Planning,331882,2025-01-01,2026-11-04
PROJ000111,WS0005,Project-111,Internal Tool,First start later. Interview guy idea during trade record.,USR000716,Django,Active,226670,2026-01-25,2026-02-09
PROJ000112,WS0024,Project-112,Analytics Dashboard,Cover moment gun study everything arm area. Than senior like each interest treatment.,USR000133,Python/FastAPI,Planning,197523,2026-01-07,2026-09-29
PROJ000113,WS0027,Project-113,Analytics Dashboard,Level without soon really man rather. Space air total life mother theory grow structure.,USR000323,Java Spring,Completed,438808,2025-05-28,2026-10-27
PROJ000114,WS0010,Project-114,ERP System,Must already job manager. Nor meet from.,USR000604,Angular,Active,143826,2024-12-28,2027-05-02
PROJ000115,WS0014,Project-115,CRM System,Form city ball. True method wonder institution nothing ever. Before decide pattern.,USR000431,Flutter,Planning,431481,2024-03-30,2026-08-25
PROJ000116,WS0029,Project-116,AI Product,Sure major reach model specific prepare ask. Theory matter music issue fish couple focus grow. Above including spend know tell form production.,USR000563,Django,Completed,198173,2025-04-16,2026-07-05
PROJ000117,WS0029,Project-117,ERP System,Choice say military reflect record. Local threat room them author.,USR000461,Java Spring,Completed,36417,2023-12-10,2026-02-10
PROJ000118,WS0014,Project-118,Analytics Dashboard,Effort site growth people these. Scene go woman course. Local language soldier top method professional.,USR000617,Flutter,On Hold,284887,2024-09-09,2024-10-12
PROJ000119,WS0006,Project-119,Analytics Dashboard,Writer impact pick blue. Water vote policy change culture yourself build. Trouble simple man truth support believe once. Nearly each scientist huge.,USR000166,Django,Planning,451652,2025-09-02,2026-04-05
PROJ000120,WS0023,Project-120,Web Application,Second will think investment. About machine bit.,USR000433,React,Active,190877,2026-06-13,2027-06-16
PROJ000121,WS0009,Project-121,Analytics Dashboard,Policy shoulder build firm. Technology local meet use.,USR000149,Angular,Planning,263993,2024-09-08,2026-09-28
PROJ000122,WS0019,Project-122,Cloud Platform,Safe officer billion mention wind production a. Result two beyond.,USR000652,React,Planning,31521,2025-03-05,2026-06-17
PROJ000123,WS0023,Project-123,Web Application,Cell whose join believe order. Way pattern beautiful former foreign set once.,USR000078,Java Spring,Planning,327911,2024-12-23,2026-10-20
PROJ000124,WS0018,Project-124,Analytics Dashboard,Attention candidate I onto. Avoid here major.,USR000121,Vue,On Hold,191819,2025-07-21,2025-10-02
PROJ000125,WS0012,Project-125,Mobile Application,Represent else win walk suggest its. Its degree similar natural place. Explain same oil win world.,USR000677,Java Spring,Completed,481595,2025-01-07,2027-02-03
PROJ000126,WS0022,Project-126,CRM System,Ok over professor listen statement senior country. Step month take painting else southern local. Notice rest play smile than.,USR000736,Python/FastAPI,Completed,220727,2026-02-02,2026-05-25
PROJ000127,WS0021,Project-127,Cloud Platform,Over medical amount indeed how apply. Reveal significant me politics late include or camera. Community measure off.,USR000188,Vue,Active,331207,2024-12-30,2026-10-14
PROJ000128,WS0029,Project-128,Internal Tool,Reach until run improve where already less over. Material officer before defense tell.,USR000484,React,Active,100601,2025-11-19,2026-04-14
PROJ000129,WS0015,Project-129,Internal Tool,Media meeting month car. Arm pay size beautiful. Amount already million apply prepare fine.,USR000697,Vue,Planning,419083,2025-12-27,2026-08-19
PROJ000130,WS0017,Project-130,ERP System,Goal down including benefit. Know deep whose consider beat ball window.,USR000780,Java Spring,Completed,26348,2026-03-14,2026-07-26
PROJ000131,WS0025,Project-131,Mobile Application,Join pressure decision customer line goal. Subject fine without check.,USR000391,Flutter,On Hold,109310,2026-05-14,2027-01-29
PROJ000132,WS0005,Project-132,Internal Tool,Force less dinner now ago serve dinner. Hope white full box. Page his government popular fine Mrs value.,USR000634,Django,Completed,450949,2024-10-04,2025-09-15
PROJ000133,WS0010,Project-133,ERP System,Message forget take. Direction bank child whatever a.,USR000479,Vue,Completed,349573,2023-10-05,2025-04-14
PROJ000134,WS0019,Project-134,Mobile Application,Decide bag evening must conference. Short turn campaign away help million international international. Within wonder tough.,USR000704,Flutter,Planning,29943,2024-06-05,2026-08-26
PROJ000135,WS0006,Project-135,ERP System,Help grow north short training certainly arm drive. Reflect sound likely. Collection thank ever four peace majority.,USR000513,Django,Active,156650,2026-05-30,2027-02-15
